{
  "cursor": "c:43",
  "status": "delta",
  "state": {
    "paused": false,
    "overwriteMode": false,
    "throttleDelayMs": 250,
    "mockRules": { "enabled": 1, "revision": 4 },
    "captureFilter": null
  },
  "items": [
    {
      "id": "tx_9f3c1a8e",
      "timestamp": "14:22:07.512",
      "startedAt": 1790605327512,
      "completedAt": 1790605327696,
      "method": "GET",
      "url": "https://api.example.com/v1/orders?status=open",
      "finalUrl": null,
      "protocol": "h2",
      "statusCode": 200,
      "durationMs": 184,
      "throttledMs": null,
      "categories": ["api"],
      "isMocked": false,
      "mockRuleId": null,
      "activeMockRuleId": "orders-500",
      "source": "okhttp",
      "requestContentType": null,
      "responseContentType": "application/json; charset=utf-8",
      "requestBodyBytes": 0,
      "responseBodyBytes": 256,
      "responseComplete": true,
      "webSocketId": null,
      "error": null
    },
    {
      "id": "tx_4b1d77a0",
      "timestamp": "14:22:09.003",
      "startedAt": 1790605329003,
      "completedAt": 1790605329325,
      "method": "POST",
      "url": "https://api.example.com/v1/orders",
      "finalUrl": null,
      "protocol": "h2",
      "statusCode": 201,
      "durationMs": 322,
      "throttledMs": null,
      "categories": ["api"],
      "isMocked": false,
      "mockRuleId": null,
      "activeMockRuleId": null,
      "source": "okhttp",
      "requestContentType": "application/json; charset=utf-8",
      "responseContentType": "application/json; charset=utf-8",
      "requestBodyBytes": 64,
      "responseBodyBytes": 128,
      "responseComplete": true,
      "webSocketId": null,
      "error": null
    },
    {
      "id": "tx_77e2c014",
      "timestamp": "14:22:11.781",
      "startedAt": 1790605331781,
      "completedAt": 1790605332822,
      "method": "GET",
      "url": "https://api.example.com/v1/orders/77e2",
      "finalUrl": null,
      "protocol": null,
      "statusCode": 500,
      "durationMs": 41,
      "throttledMs": 1000,
      "categories": ["api"],
      "isMocked": true,
      "mockRuleId": "orders-500",
      "activeMockRuleId": "orders-500",
      "source": "okhttp",
      "requestContentType": null,
      "responseContentType": "application/json",
      "requestBodyBytes": 0,
      "responseBodyBytes": 17,
      "responseComplete": true,
      "webSocketId": null,
      "error": null
    }
  ]
}
